cse1/cse1@172.16.15.210:1521/oracle

CREATE TABLE CLIENT_MASTER53(
	CLIENT_NO VARCHAR2(6) PRIMARY KEY,
	NAME VARCHAR2(20) NOT NULL,
	CITY VARCHAR2(15),
	PINCODE NUMBER(8),
	STATE VARCHAR2(15),
	BAL_DUE NUMBER(10,2),
	CHECK(CLIENT_NO LIKE 'C%')
); 

CREATE TABLE PRODUCT_MASTER53(
	PRODUCT_NO VARCHAR2(6) PRIMARY KEY,
	DESCRIPTION VARCHAR2(15) NOT NULL,
	PROFIT_PERCENT NUMBER(4,2) NOT NULL,
	UNIT_MEASURE VARCHAR2(10) NOT NULL,
	QTY_ON_HAND NUMBER(8) NOT NULL,
	REORDER_LVL NUMBER(8) NOT NULL,
	SELL_PRICE NUMBER(8,2) NOT NULL CHECK(SELL_PRICE>0),
	COST_PRICE NUMBER(8,2) NOT NULL CHECK(COST_PRICE>0),
	CHECK(PRODUCT_NO LIKE 'P%')
);

CREATE TABLE SALESMAN_MASTER53(
	SALESMAN_NO VARCHAR2(6) PRIMARY KEY,
	SALESMAN_NAME VARCHAR2(20) NOT NULL,
	ADDRESS1 VARCHAR2(10) NOT NULL,
	ADDRESS2 VARCHAR2(10),
	CITY VARCHAR2(20),
	PINCODE NUMBER(7),
	STATE VARCHAR2(20),
	SAL_AMT NUMBER(8,2) NOT NULL CHECK(SAL_AMT >0),
	TGT_TO_GET NUMBER(6,2) NOT NULL CHECK(TGT_TO_GET >0),
	YTD_SALES NUMBER(6,2) NOT NULL,
	REMARKS VARCHAR2(20),
	CHECK(SALESMAN_NO LIKE 'S%')
);

CREATE TABLE SALES_ORDER53(
	ORDER_NO VARCHAR2(6) PRIMARY KEY,
	ORDER_DATE DATE,
	CLIENT_NO VARCHAR2(6) REFERENCES CLIENT_MASTER53(CLIENT_NO),
	DELY_ADDRESS VARCHAR2(25),
	SALESMAN_NO VARCHAR(6) REFERENCES SALESMAN_MASTER53(SALESMAN_NO),
	DELY_TYPE CHAR(1) DEFAULT 'F' CHECK (DELY_TYPE IN ('P','F')),
	BILLED_YN CHAR(1),
	DELY_DATE DATE,
	ORDER_STATUS VARCHAR2(10) CHECK (ORDER_STATUS IN ('IN PROCESS','FULFILLED','BACKORDER','CANCELLED')),
	CHECK(ORDER_NO LIKE 'O%'),
	CHECK(DELY_DATE>ORDER_DATE)
);

CREATE TABLE SALES_ORDER_DETAILS53 (
    ORDER_NO VARCHAR2(6),
    PRODUCT_NO VARCHAR2(6),
    QTY_ORDERED NUMBER(8),
    QTY_DISP NUMBER(8),
    PRODUCT_RATE NUMBER(10,2),
    PRIMARY KEY (ORDER_NO, PRODUCT_NO),
    FOREIGN KEY (ORDER_NO) REFERENCES SALES_ORDER53(ORDER_NO),
    FOREIGN KEY (PRODUCT_NO) REFERENCES PRODUCT_MASTER53(PRODUCT_NO)
);

//CLIENT_MASTER TABLE
INSERT INTO CLIENT_MASTER53 VALUES('C00001','IVAN BAYROSS','MUMBAI',400054,'MAHARASHTRA',15000);
INSERT INTO CLIENT_MASTER53 VALUES('C00002','MAMTA MAZUMDAR','MADRAS',780001,'TAMIL NADU',0);
INSERT INTO CLIENT_MASTER53 VALUES('C00003','CHHAYA BANKAR','MUMBAI',400057,'MAHARASHTRA',5000);
INSERT INTO CLIENT_MASTER53 VALUES('C00004','ASHWINI JOSHI','BANGALORE',560001,'KARNATAKA',0);
INSERT INTO CLIENT_MASTER53 VALUES('C00005','HANSEL COLACO','MUMBAI',400060,'MAHARASHTRA',2000);
INSERT INTO CLIENT_MASTER53 VALUES('C00006','DEEPAK SHARMA','MANGALORE',560050,'KARNATAKA',0);


//PRODUCT_MASTER TABLE
INSERT INTO PRODUCT_MASTER53 VALUES('P00001','T-SHIRTS',5,'PIECE',200,50,350,250);
INSERT INTO PRODUCT_MASTER53 VALUES('P03453','SHIRTS',6,'PIECE',150,50,500,350);
INSERT INTO PRODUCT_MASTER53 VALUES('P06734','COTTON JEANS',5,'PIECE',100,20,600,450);
INSERT INTO PRODUCT_MASTER53 VALUES('P07865','JEANS',5,'PIECE',100,20,750,500);
INSERT INTO PRODUCT_MASTER53 VALUES('P07868','TROUSERS',2,'PIECE',150,50,850,550);
INSERT INTO PRODUCT_MASTER53 VALUES('P07885','PuM-Overs',2.5,'PIECE',80,30,700,450);
INSERT INTO PRODUCT_MASTER53 VALUES('P07965','DENIM SHIRTS',4,'PIECE',100,40,350,250);
INSERT INTO PRODUCT_MASTER53 VALUES('P07975','LYERS TOP',5,'PIECE',70,30,300,175);
INSERT INTO PRODUCT_MASTER53 VALUES('P08865','SKIRTS',5,'PIECE',75,30,450,300);


//SALESMAN_MASTER
INSERT INTO  SALESMAN_MASTER53 VALUES('S00001','AMAN','A/14','WORLI','MUMBAI',400002,'MAHARASHTRA',3000,100,50,'GOOD');
INSERT INTO  SALESMAN_MASTER53 VALUES('S00002','OMKAR','65','NARIMAN','MUMBAI',400001,'MAHARASHTRA',3000,200,100,'GOOD');
INSERT INTO  SALESMAN_MASTER53 VALUES('S00003','RAJ','P-7','BANDRA','MUMBAI',400032,'MAHARASHTRA',3000,200,100,'GOOD');
INSERT INTO  SALESMAN_MASTER53 VALUES('S00004','ASHISH','A/5','JUHU','MUMBAI',400044,'MAHARASHTRA',3500,200,150,'GOOD');

//SALES_ORDER_DETAILS
INSERT INTO SALES_ORDER_DETAILS53 VALUES('O19001','P00001',4,4,350);
INSERT INTO SALES_ORDER_DETAILS53 VALUES('O19001','P07965',2,1,350);
INSERT INTO SALES_ORDER_DETAILS53 VALUES('O19001','P07885',2,1,700);
INSERT INTO SALES_ORDER_DETAILS53 VALUES('O19002','P00001',10,0,350);
INSERT INTO SALES_ORDER_DETAILS53 VALUES('O46865','P07868',3,3,850);
INSERT INTO SALES_ORDER_DETAILS53 VALUES('O46865','P07885',3,1,700);
INSERT INTO SALES_ORDER_DETAILS53 VALUES('O46865','P00001',10,10,350);
INSERT INTO SALES_ORDER_DETAILS53 VALUES('O46865','P03454',4,4,500);
INSERT INTO SALES_ORDER_DETAILS53 VALUES('O19003','P03453',2,2,500);
INSERT INTO SALES_ORDER_DETAILS53 VALUES('O19003','P06734',1,1,600);
INSERT INTO SALES_ORDER_DETAILS53 VALUES('O46866','P07965',1,0,350);
INSERT INTO SALES_ORDER_DETAILS53 VALUES('O46866','P07975',1,0,300);
INSERT INTO SALES_ORDER_DETAILS53 VALUES('O19008','P00001',10,5,350);
INSERT INTO SALES_ORDER_DETAILS53 VALUES('O19008','P07975',5,3,300);


//Sales_order
insert into sales_order53 values('O19001','20-July-02','C00001','ABC HOUSE','S00001','F','N' ,'12-June-04', 'IN PROCESS');
insert into sales_order53 values('O19002','27-June-02','C00002','ABC HOUSE','S00002','P','N' ,'25-June-04', 'CANCELLED');
insert into sales_order53 values('O46865','20-Feb-02','C00002','ABC HOUSE','S00003','F','Y' ,'18-Feb-04', 'FULFILLED');
insert into sales_order53 values('O19003','07-Apr-02','C00001','ABC HOUSE','S00001','F','Y' ,'03-Apr-04', 'FULFILLED');
insert into sales_order53 values('O46866','22-May-02','C00004','ABC HOUSE','S00002','P','N' ,'20-May-04', 'CANCELLED');
insert into sales_order53 values('O19008','26-July-02','C00005','ABC HOUSE','S00004','F','N' ,'24-May-04', 'IN PROCESS');

A)SELECT NAME FROM CLIENT_MASTER53 WHERE NAME LIKE '_A%';

NAME
--------------------
MAMTA MAZUMDAR
HANSEL COLACO

B)SELECT CITY FROM CLIENT_MASTER53 WHERE CITY LIKE '_A%';

CITY
---------------
MADRAS
BANGALORE
MANGALORE

C)SELECT * FROM CLIENT_MASTER53 WHERE CITY IN ('MUMBAI','DELHI');

CLIENT NAME                 CITY               PINCODE STATE              BAL_DUE
------ -------------------- --------------- ---------- --------------- ----------
C00001 IVAN BAYROSS         MUMBAI              400054 MAHARASHTRA          15000
C00003 CHHAYA BANKAR        MUMBAI              400057 MAHARASHTRA           5000
C00005 HANSEL COLACO        MUMBAI              400060 MAHARASHTRA           2000

D)SELECT * FROM CLIENT_MASTER53 WHERE BAL_DUE>10000;

CLIENT NAME                 CITY               PINCODE STATE              BAL_DUE
------ -------------------- --------------- ---------- --------------- ----------
C00001 IVAN BAYROSS         MUMBAI              400054 MAHARASHTRA          15000

E)SELECT * FROM SALES_ORDER53 WHERE EXTRACT(MONTH FROM ORDER_DATE)=2;

ORDER_ ORDER_DAT CLIENT DELY_ADDRESS              SALESM D B DELY_DATE ORDER_STAT
------ --------- ------ ------------------------- ------ - - --------- ----------
O46865 20-FEB-02 C00002 ABC HOUSE                 S00003 F Y 18-FEB-04 FULFILLED

f)SELECT * FROM SALES_ORDER53 WHERE CLIENT_NO='C00001' OR CLIENT_NO='C00002';

ORDER_ ORDER_DAT CLIENT DELY_ADDRESS              SALESM D B DELY_DATE ORDER_STAT
------ --------- ------ ------------------------- ------ - - --------- ----------
O19001 20-JUL-02 C00001 ABC HOUSE                 S00001 F N 12-JUN-04 IN PROCESS
O19002 27-JUN-02 C00002 ABC HOUSE                 S00002 P N 25-JUN-04 CANCELLED
O46865 20-FEB-02 C00002 ABC HOUSE                 S00003 F Y 18-FEB-04 FULFILLED
O19003 07-APR-02 C00001 ABC HOUSE                 S00001 F Y 03-APR-04 FULFILLED

G)SELECT * FROM PRODUCT_MASTER53 WHERE SELL_PRICE>200 AND SELL_PRICE<=500;

PRODUC DESCRIPTION     PROFIT_PERCENT UNIT_MEASU QTY_ON_HAND REORDER_LVL SELL_PRICE COST_PRICE
------ --------------- -------------- ---------- ----------- ----------- ---------- ----------
P00001 T-SHIRTS                     5 PIECE              200          50        350        250
P03453 SHIRTS                       6 PIECE              150          50        500        350
P07965 DENIM SHIRTS                 4 PIECE              100          40        350        250
P07975 LYERS TOP                    5 PIECE               70          30        300        175
P08865 SKIRTS                       5 PIECE               75          30        450        300

H)SELECT * FROM PRODUCT_MASTER53 WHERE SELL_PRICE>1500;
SELECT PRODUCT_NO,DESCRIPTION,SELL_PRICE,SELL_PRICE*0.15 AS NEW_PRICE FROM PRODUCT_MASTER53 WHERE SELL_PRICE>150;

PRODUC DESCRIPTION     SELL_PRICE  NEW_PRICE
------ --------------- ---------- ----------
P00001 T-SHIRTS               350       52.5
P03453 SHIRTS                 500         75
P06734 COTTON JEANS           600         90
P07865 JEANS                  750      112.5
P07868 TROUSERS               850      127.5
P07885 PuM-Overs              700        105
P07965 DENIM SHIRTS           350       52.5
P07975 LYERS TOP              300         45
P08865 SKIRTS                 450       67.5

i)SELECT NAME, CITY, STATE FROM CLIENT_MASTER53 WHERE STATE NOT LIKE 'MAHARASHTRA';

NAME                 CITY            STATE
-------------------- --------------- ---------------
MAMTA MAZUMDAR       MADRAS          TAMIL NADU
ASHWINI JOSHI        BANGALORE       KARNATAKA
DEEPAK SHARMA        MANGALORE       KARNATAKA

j)SELECT COUNT(*) FROM SALES_ORDER53;

 COUNT(*)
----------
         6

K)SELECT AVG(PRODUCT_RATE) FROM SALES_ORDER_DETAILS53;

AVG(PRODUCT_RATE)
-----------------
       465.384615

I)SELECT MIN(COST_PRICE) AS MAX_PRICE, MAX(COST_PRICE) AS MIN_PRICE FROM PRODUCT_MASTER53;

 MAX_PRICE  MIN_PRICE
---------- ----------
       175        550

M)SELECT COUNT(*) FROM PRODUCT_MASTER53 WHERE COST_PRICE>=1500;
SELECT COUNT(*) FROM PRODUCT_MASTER53 WHERE COST_PRICE>=150;

  COUNT(*)
----------
         9

N)SELECT * FROM PRODUCT_MASTER53 WHERE (QTY_ON_HAND < REORDER_LVL);

no rows selected

O)SELECT ORDER_NO,TO_CHAR(ORDER_DATE, 'DAY') AS ORDER_DAY FROM SALES_ORDER53;

ORDER_ ORDER_DAY
------ ---------
O19001 SATURDAY
O19002 THURSDAY
O46865 WEDNESDAY
O19003 SUNDAY
O46866 WEDNESDAY
O19008 FRIDAY

SELECT * FROM DUAL;
DESC DUAL;
SELECT 5+2 FROM DUAL;
SELECT SQRT(25) FROM DUAL;
SELECT SYSDATE FROM DUAL;
SELECT SYSTIMESTAMP FROM DUAL;

1)A) SELECT SYSTIMESTAMP FROM DUAL;

SYSTIMESTAMP
---------------------------------------------------------------------------
11-FEB-26 10.11.56.021000 AM +05:30

1)B)SELECT 2*2 FROM DUAL;

       2*2
----------
         4

1)C)SELECT ABS(-15) FROM DUAL;

  ABS(-15)
----------
        15

1)D)SELECT SQRT(15) FROM DUAL;

  SQRT(15)
----------
3.87298335

1)E)SELECT ROUND(15.19) FROM DUAL;

ROUND(15.19)
------------
          15

1)F) SELECT LOWER('IVAN BAYROSS') FROM DUAL;

LOWER('IVANB
------------
ivan bayross

1)G)SELECT UPPER('ivan bayross') FROM DUAL;

UPPER('IVANB
------------
IVAN BAYROSS

1)H)SELECT ADD_MONTHS(SYSDATE,5) FROM DUAL;

ADD_MONTH
---------
11-JUL-26

1)I)SELECT MONTHS_BETWEEN('02-JUL-01','02-JAN-01') FROM DUAL;

MONTHS_BETWEEN('02-JUL-01','02-JAN-01')
---------------------------------------
                                      6

1)J)SELECT TO_CHAR(SYSDATE,'DD-MM-YYYY') FROM DUAL;

TO_CHAR(SY
----------
11-02-2026

3)A)SELECT ENAME FROM EMP_53 WHERE ENAME LIKE '_i%';

3)B)SELECT ENAME FROM EMP_53 WHERE MGR IS NULL;

3)C) SELECT MAX(SAL) AS MAXIMUM,MIN(SAL) AS MINIMUM,SUM(SAL) AS TOTAL,AVG(SAL) AS AVERAGE FROM EMP_53;

3)D)SELECT MAX(SAL) AS MAXIMUM,MIN(SAL) AS MINIMUM,SUM(SAL) AS TOTAL,AVG(SAL) AS AVERAGE FROM EMP_53 GROUP BY JOB;

3)E)SELECT COUNT(JOB) AS NUMBER_OF_MANAGERS FROM EMP_53 WHERE JOB='Manager';

3)f)SELECT ENAME,EMPNO FROM EMP_53 WHERE HIREDATE>'01-JAN-80';

3)g)SELECT ENAME FROM EMP_53 WHERE  JOB LIKE 'Salesman%' AND SAL=(SELECT MAX(SAL) FrOM EMP_53 WHERE JOB LIKE 'Salesman%');

3)h)SELECT ENAME FROM EMP_53 WHERE  JOB LIKE 'Clerk%' AND SAL=(SELECT MAX(SAL) FrOM EMP_53 WHERE JOB LIKE 'Clerk%');

3)i)SELECT D.DEPT_NAME,E.ENAME FROM EMP_53,DEPT_53 WHERE E.ENAME='Scott' AND D.DEPTNO=(SELECT DEPTNO FROM EMP_53 WHERE ENAME='Scott');

3)j)SELECT D.DEPT_NAME FROM DEPT_53 D,EMP_53 E WHERE E.DEPTNO=D.DEPTNO AND E.SAL =(SELECT MAX(SAL) FROM EMP_53);

3)K)SELECT * FROM EMP_53 WHERE SAL > (SELECT MAX(SAL) FROM EMP_53 WHERE ENAME='Turner');

-----------------------------------------------------------------------------------------------------------------------------------


Assignment-4

1)CREATE TABLE SAILORS_53S(
	s_id Number(6) PRIMARY KEY,
	s_name VARCHAR2(20) NOT NULL,
	rating Number(5) check (rating in (1,2,3,4,5)),
	age Number(2)
);

CREATE TABLE BOATS_53S(
	b_id Number(6) PRIMARY KEY,
	b_name VARCHAR(20) NOT NULL,
	color VARCHAR(10) NOT NULL
);

CREATE TABLE RESERVES_53S(
	s_id Number(6),
	b_id Number(6),
	day VARCHAR2(10) Not NULL,
	PRIMARY KEY(s_id,b_id),
	FOREIGN KEY(s_id) references SAILORS_53S(s_id),
	FOREIGN KEY(b_id) references BOATS_53S(b_id)
);

INSERT INTO SAILORS_53S VALUES(000001,'Tarun',3,45);

INSERT INTO SAILORS_53S VALUES(000002,'Spandan',5,22);

INSERT INTO SAILORS_53S VALUES(000003,'Santanu',5,21);

INSERT INTO SAILORS_53S VALUES(000004,'Ajoy',5,22);

INSERT INTO SAILORS_53S VALUES(000005,'Srijit',5,22);

INSERT INTO SAILORS_53S VALUES(000006,'Aayush',5,20);

 INSERT INTO SAILORS_53S VALUES(000007,'John',5,61);


INSERT INTO BOATS_53S VALUES(100000,'B1','red');

INSERT INTO BOATS_53S VALUES(200000,'B2','red');

INSERT INTO BOATS_53S VALUES(300000,'B3','blue');

INSERT INTO BOATS_53S VALUES(400000,'B4','yellow');

INSERT INTO BOATS_53S VALUES(500000,'B5','pink');

INSERT INTO BOATS_53S VALUES(700000,'B7','orange');


INSERT INTO RESERVES_53S VALUES(000001,100000,'MONDAY');

INSERT INTO RESERVES_53S VALUES(000002,200000,'TUESDAY');

INSERT INTO RESERVES_53S VALUES(000003,300000,'WEDNESDAY');

INSERT INTO RESERVES_53S VALUES(000004,400000,'THURSDAY');

INSERT INTO RESERVES_53S VALUES(000005,500000,'FRIDAY');

INSERT INTO RESERVES_53S VALUES(000006,600000,'SATURDAY');

INSERT INTO RESERVES_53S VALUES(000007,700000,'SATURDAY');

SELECT * FROM SAILORS_53S;

      S_ID S_NAME                   RATING        AGE
---------- -------------------- ---------- ----------
         1 Tarun                         3         45
         2 Spandan                       5         22
         3 Santanu                       5         21
         4 Ajoy                          5         22
         5 Srijit                        5         22
         6 Aayush                        5         20

1)a)SELECT B.color FROM BOATS_53S B,SAILORS_53S S,RESERVES_53S R WHERE S.s_id=R.s_id and B.b_id=R.b_id and S.s_name='Tarun';

COLOR
----------
red

1)b)SELECT S.s_id,S.s_name FROM BOATS_53S B,SAILORS_53S S,RESERVES_53S R WHERE S.s_id=R.s_id and B.b_id=R.b_id and R.day='MONDAY';

      S_ID S_NAME
---------- --------------------
         1 Tarun

1)c) SELECT * FROM BOATS_53S WHERE color='red' or color='blue';

      B_ID B_NAME               COLOR
---------- -------------------- ----------
    100000 B1                   red
    200000 B2                   red
    300000 B3                   blue

1)d)DELETE FROM RESERVES_53S WHERE s_id in (SELECT s_id FROM SAILORS_53S where age>60);

DELETE FROM SAILORS_53S WHERE age>60;

 SELECT * FROM SAILORS_53S;

      S_ID S_NAME                   RATING        AGE
---------- -------------------- ---------- ----------
         1 Tarun                         3         45
         2 Spandan                       5         22
         3 Santanu                       5         21
         4 Ajoy                          5         22
         5 Srijit                        5         22
         6 Aayush                        5         20

2)i)CREATE TABLE TEACHER_53S(
  2     Tid Number(6) PRIMARY KEY,
  3     NAME VARCHAR2(15) NOT NULL,
  4     DEPT VARCHAR2(20) NOT NULL
  5  );


ii)CREATE TABLE SUBJECT_53S(
  2     SUBNO NUMBER(4) PRIMARY KEY,
  3     SUBTITLE VARCHAR2(15) NOT NULL
  4  );

iii)CREATE TABLE TAUGHTBY_53S(
  2     Tid Number(6),
  3     SUBNO Number(4),
  4     PRIMARY KEY(Tid,SUBNO),
  5     FOREIGN KEY(Tid) References TEACHER_53S(Tid),
  6     FOREIGN KEY(SUBNO) References SUBJECT_53S(SUBNO));

iv) CREATE TABLE STUDENT_53S(
  2     Rollno Number(4) PRIMARY KEY,
  3     Sname VARCHAR2(15) NOT NULL,
  4     City VARCHAR2(15) NOT NULL);

2)a)INSERT INTO TEACHER_53S VALUES('0001','Sharabh','Math');

INSERT INTO TEACHER_53S VALUES('0002','SOM','Physics');

INSERT INTO TEACHER_53S VALUES('0003','SNJ','Biology');

INSERT INTO TEACHER_53S VALUES('0004','SID','Chemistry');

INSERT INTO TEACHER_53S VALUES('0005','JEET','Math');

INSERT INTO TEACHER_53S VALUES('0006','SAMRAT','DBMS');


INSERT INTO SUBJECT_53S VALUES('0100','THERMODYNAMICS');

INSERT INTO SUBJECT_53S VALUES('0200','LASER');

INSERT INTO SUBJECT_53S VALUES('0300','REPRODUCTION');

INSERT INTO SUBJECT_53S VALUES('0400','ORGANICS');

INSERT INTO SUBJECT_53S VALUES('0500','ALGEBRA');

INSERT INTO SUBJECT_53S VALUES('0600','SQL');






INSERT INTO TAUGHTBY_53S VALUES(0001,'0100');

INSERT INTO TAUGHTBY_53S VALUES('0002','0200');

INSERT INTO TAUGHTBY_53S VALUES('0003','0300');

INSERT INTO TAUGHTBY_53S VALUES('0004','0400');

INSERT INTO TAUGHTBY_53S VALUES('0005','0500');

INSERT INTO TAUGHTBY_53S VALUES('0006','0600');

INSERT INTO TAUGHTBY_53S VALUES(0002,0100);




INSERT INTO STUDENT_53S VALUES(101,'IMON','KOLKATA');

INSERT INTO STUDENT_53S VALUES(102,'SUBHAJIT','KHIDIRPUR');

INSERT INTO STUDENT_53S VALUES(103,'SAYAN','HOWRAH');

INSERT INTO STUDENT_53S VALUES(104,'SRIJIT','HOWRAH');

INSERT INTO STUDENT_53S VALUES(105,'KAZI','MURSHIDABAD');

INSERT INTO STUDENT_53S VALUES(106,'SANTANU','BANKURA');

INSERT INTO STUDENT_53S VALUES(22,'SANTANU','KOLKATA');

INSERT INTO STUDENT_53S VALUES(23,'SANTANU','KOLKATA');




2)A)Get the names of all the teachers of ‘Physics’ department who teach ‘Thermodynamics’. 
	Select T.NAME from TEACHER_53S T,TAUGHTBY_53S a ,SUBJECT_53S S where a.SUBNO=S.SUBNO and a.Tid=T.Tid  and T.DEPT='Physics' and S.SUBTITLE='THERMORDYNAMICS';

B)UPDATE SUBJECT_53S set SUBTITLE='RDMS' where SUBTITLE='SQL';

     SUBNO SUBTITLE
---------- ---------------
       100 THERMODYNAMICS
       200 LASER
       300 REPRODUCTION
       400 ORGANICS
       500 ALGEBRA
       600 RDMS


C)select * from STUDENT_53S where Rollno between 20 and 25  and City='KOLKATA';

   ROLLNO SNAME           CITY
---------- --------------- ---------------
        22 SANTANU         KOLKATA
        23 SANTANU         KOLKATA

D)select * from STUDENT_53S where City='KOLKATA' order by Rollno DESC;

    ROLLNO SNAME           CITY
---------- --------------- ---------------
       105 Srijit          Kolkata
       102 Jana            Kolkata
       101 Imon            Kolkata
        24 jit             Kolkata
        21 Sayak           Kolkata


ASSIGNMENT-5
--------------------------------------------------------------

CREATE TABLE ZIPCODE_53(
	ZIP Number(6) PRIMARY KEY,
	CITY VARCHAR2(15)
);

CREATE TABLE EMPLOYEES_53(
	ENO NUMBER(4) PRIMARY KEY,
	ENAME VARCHAR2(15) NOT NULL,
	ZIP NUMBER(6) ,
	HDATE DATE NOT NULL,
	FOREIGN KEY(ZIP) REFERENCES ZIPCODE_53(ZIP)
);

CREATE TABLE CUSTOMERS_53(
	CNO NUMBER(4) PRIMARY KEY,
	CNAME NUMBER(4) NOT NULL,
	STREET VARCHAR2(18),
	ZIP NUMBER(6) NOT NULL,
	PHONE NUMBER(18),
	FOREIGN KEY(ZIP) REFERENCES ZIPCODE_53(ZIP)
);

CREATE TABLE ORDERS_53(
	ONO NUMBER(4) PRIMARY KEY,
	CNO NUMBER(4) NOT NULL,
	ENO NUMBER(4) NOT NULL,
	RECEIVED DATE,
	SHIPPED DATE,
	FOREIGN KEY(CNO) REFERENCES CUSTOMERS_53(CNO),
	FOREIGN KEY(ENO) REFERENCES EMPLOYEES_53(ENO)
);

CREATE TABLE PARTS_53(
	PNO NUMBER(4) PRIMARY KEY,
	PNAME VARCHAR2(15) NOT NULL,
	QOH NUMBER(15) NOT NULL,	
	PRICE NUMBER(5) NOT NULL,
	LEV NUMBER(3)
);

 
CREATE TABLE ODETAILS_53(
	ONO NUMBER(4),
	PNO NUMBER(4),
	QTY NUMBER(4),
	PRIMARY KEY(ONO,PNO),
	FOREIGN KEY(ONO) REFERENCES ORDERS_53(ONO),
	FOREIGN KEY(PNO) REFERENCES PARTS_53(PNO)
);


INSERT INTO ZIPCODE_53 VALUES (10001, 'New York');
INSERT INTO ZIPCODE_53 VALUES (90210, 'Beverly Hills');
INSERT INTO ZIPCODE_53 VALUES (60601, 'Chicago');
INSERT INTO ZIPCODE_53 VALUES (30301, 'Atlanta');
INSERT INTO ZIPCODE_53 VALUES (94105, 'San Francisco');
INSERT INTO ZIPCODE_53 VALUES (92105, 'Mumbai');



INSERT INTO EMPLOYEES_53 VALUES (101, 'John', 10001, '15-Jan-2020');
INSERT INTO EMPLOYEES_53 VALUES (102, 'Alice', 90210, '10-Mar-2019');
INSERT INTO EMPLOYEES_53 VALUES (103, 'Robert', 60601,'21-Jul-2022');
INSERT INTO EMPLOYEES_53 VALUES (104, 'Emma', 30301, '05-Nov-2011');
INSERT INTO EMPLOYEES_53 VALUES (105, 'David', 94105, '30-Jun-2015');


INSERT INTO CUSTOMERS_53 VALUES (201, 1111, '1st Street', 10001, 9876543210);
INSERT INTO CUSTOMERS_53 VALUES (202, 2222, '2nd Avenue', 90210, 8765432109);
INSERT INTO CUSTOMERS_53 VALUES (203, 3333, '3rd Blvd', 60601, 7654321098);
INSERT INTO CUSTOMERS_53 VALUES (204, 4444, '4th Lane', 30301, 6543210987);
INSERT INTO CUSTOMERS_53 VALUES (205, 5555, '5th Road', 94105, 5432109876);


INSERT INTO ORDERS_53 VALUES (301, 201, 101,'10-Jan-2023',  '12-Jan-2023');
INSERT INTO ORDERS_53 VALUES (302, 202, 102,  '15-Feb-2023',  '18-Feb-2023');
INSERT INTO ORDERS_53 VALUES (303, 203, 103,  '20-Mar-2023',  '22-Mar-2023');
INSERT INTO ORDERS_53 VALUES (304, 204, 104,  '25-Apr-2023',  '28-Apr-2023');
INSERT INTO ORDERS_53 VALUES (305, 205, 105,  '30-May-2023',  '02-Jun-2023');


INSERT INTO PARTS_53 VALUES (401, 'Bolt', 500, 10, 50);
INSERT INTO PARTS_53 VALUES (402, 'Nut', 800, 5, 100);
INSERT INTO PARTS_53 VALUES (403, 'Screw', 600, 8, 75);
INSERT INTO PARTS_53 VALUES (404, 'Washer', 900, 3, 120);
INSERT INTO PARTS_53 VALUES (405, 'Pipe', 300, 25, 40);
INSERT INTO PARTS_53 VALUES (406,'Plus',400,21000,2);

INSERT INTO ODETAILS_53 VALUES (301, 401, 50);
INSERT INTO ODETAILS_53 VALUES (302, 402, 100);
INSERT INTO ODETAILS_53 VALUES (303, 403, 75);
INSERT INTO ODETAILS_53 VALUES (304, 404, 120);
INSERT INTO ODETAILS_53 VALUES (305, 405, 40);

Questions
-----------------------------------------------

Q1)SELECT PNO, PNAME
  2  FROM PARTS_53
  3  WHERE PRICE < 20;

       PNO PNAME
---------- ---------------
       401 Bolt
       402 Nut
       403 Screw
       404 Washer

Q2)SELECT DISTINCT PNO
  2  FROM ODETAILS_53;

       PNO
----------
       403
       404
       402
       401
       405

Q6)SELECT ENAME
  2  FROM EMPLOYEES_53
  3  WHERE HDATE = (SELECT MIN(HDATE) FROM EMPLOYEES_53);

ENAME
---------------
Emma


Q7)SELECT PNO,PNAME,PRICE FROM PARTS_53 WHERE PRICE>20000 ORDER BY PNO ASC;

Q8)SELECT P.PNO, P.PNAME, SUM(O.QTY * P.PRICE) AS TOTAL_SALES
FROM PARTS_53 P
JOIN ODETAILS_53 O ON P.PNO = O.PNO
GROUP BY P.PNO, P.PNAME;

Q8)SELECT SUM(QTY) AS TOTAL_QUANTITY
FROM ODETAILS_53
WHERE PNO = 10601;

TOTAL_QUANTITY
--------------


Q9)SELECT E.ENO
FROM EMPLOYEES_53 E
JOIN ZIPCODE_53 Z ON E.ZIP = Z.ZIP
WHERE Z.CITY = 'San Francisco';

       ENO
----------
       105


ASSIGNMENT-6
-----------------------------------------------------------------------


Q1)CREATE TABLE CUSTOMER_53(
	CUSTOMERID NUMBER(2) PRIMARY KEY,
	CUSTOMERNAME VARCHAR2(20) NOT NULL,
	CONTACTNAME VARCHAR2(20) NOT NULL,
	ADDRESS VARCHAR2(30),
	CITY VARCHAR2(15),
	POSTALCODE  NUMBER(5),
	COUNTRY VARCHAR2(20)
);

CREATE TABLE SUPPLIER_53(
	SUPPLIERID NUMBER(2) PRIMARY KEY,
	SUPPLIERNAME VARCHAR2(20) NOT NULL,
	CONTACTNAME VARCHAR2(20) NOT NULL,
	ADDRESS VARCHAR2(30),
	CITY VARCHAR2(15),
	POSTALCODE  NUMBER(5),
	COUNTRY VARCHAR2(20)
);


INSERT INTO CUSTOMER_53 VALUES(1,'Alfreds Futter','Maria Anders','Obere Str.57','Berlin',12209,'Germany');
INSERT INTO CUSTOMER_53 VALUES(2,'Ana Helados','Ana Trujillo','Avda. Construction 2222','Mexico D.F',05021,'Mexico');
INSERT INTO CUSTOMER_53 VALUES(3,'Antonio Moreno','Antonio Moreno','Mataderos 2312','Mexico D.F',05023,'Mexico');


INSERT INTO SUPPLIER_53 VALUES(1,'Exotic Liquid','Charlotte Cooper','49 Gilbert St.','Berlin',12209,'Germany');
INSERT INTO SUPPLIER_53 VALUES(2,'New Orleans Cajun','Shelley Burke','P.O.Box 78934','Mexico D.F',05023,'Mexico');
INSERT INTO SUPPLIER_53 VALUES(3,'Grandma Kelly','Regina Murphy','707 Oxford Rd.','Ann Arbor',48104,'USA');


a)SELECT DISTINCT(CITY) FROM CUSTOMER_53 UNION SELECT DISTINCT(CITY) FROM SUPPLIER_53;

CITY
---------------
Ann Arbor
Berlin
Mexico D.F

b)SELECT CITY FROM CUSTOMER_53 UNION SELECT CITY FROM SUPPLIER_53;

CITY
---------------
Ann Arbor
Berlin
Mexico D.F

c)SELECT CITY FROM CUSTOMER_53 WHERE COUNTRY='Germany' UNION SELECT CITY FROM SUPPLIER_53 WHERE COUNTRY='Germany';

CITY
---------------
Berlin

e)SELECT COUNTRY FROM SUPPLIER_53 MINUS SELECT COUNTRY FROM CUSTOMER_53;

COUNTRY
--------------------
USA

